{
  "$schema": "https://json-schema.org/draft/2020-12/schema",
  "$id": "https://contracts.surfaces.local/surfaces.web.contract.schema.json",
  "title": "Surfaces Web Contract",
  "type": "object",
  "additionalProperties": false,
  "required": [
    "contractId",
    "version",
    "surfaces",
    "sections",
    "constraints"
  ],
  "properties": {
    "$schema": {
      "type": "string",
      "format": "uri-reference"
    },
    "contractId": {
      "type": "string",
      "minLength": 1
    },
    "version": {
      "type": "string",
      "pattern": "^[0-9]+\\.[0-9]+\\.[0-9]+$"
    },
    "description": {
      "type": "string"
    },
    "surfaces": {
      "type": "array",
      "minItems": 1,
      "items": {
        "$ref": "#/$defs/surface"
      }
    },
    "sections": {
      "type": "array",
      "minItems": 1,
      "items": {
        "$ref": "#/$defs/section"
      }
    },
    "constraints": {
      "$ref": "#/$defs/constraints"
    },
    "color": {
      "$ref": "#/$defs/color"
    }
  },
  "$defs": {
    "surface": {
      "type": "object",
      "additionalProperties": false,
      "required": [
        "id",
        "displayName",
        "type",
        "requiredSections",
        "allowedFonts",
        "layout"
      ],
      "properties": {
        "id": {
          "type": "string",
          "pattern": "^[a-z0-9-]+$"
        },
        "displayName": {
          "type": "string",
          "minLength": 1
        },
        "type": {
          "type": "string",
          "enum": [
            "web",
            "cli"
          ]
        },
        "requiredSections": {
          "type": "array",
          "minItems": 1,
          "items": {
            "type": "string",
            "pattern": "^[a-z0-9]+(\\.[a-z0-9]+)*$"
          },
          "uniqueItems": true
        },
        "allowedFonts": {
          "type": "array",
          "minItems": 1,
          "items": {
            "type": "string",
            "minLength": 1
          },
          "uniqueItems": true
        },
        "allowedColors": {
          "type": "array",
          "minItems": 1,
          "items": {
            "type": "string",
            "minLength": 1
          },
          "uniqueItems": true,
          "description": "Deprecated: Use color.sourceOfTruth and color.rawValues instead. This field will be removed in a future version."
        },
        "layout": {
          "type": "object",
          "additionalProperties": false,
          "required": [
            "maxContentWidth"
          ],
          "properties": {
            "maxContentWidth": {
              "type": "number",
              "minimum": 1
            },
            "requiredContainers": {
              "type": "array",
              "items": {
                "type": "string",
                "minLength": 1
              },
              "uniqueItems": true
            },
            "pageFrame": {
              "$ref": "#/$defs/pageFrame"
            }
          }
        }
      }
    },
    "section": {
      "type": "object",
      "additionalProperties": false,
      "required": [
        "id",
        "intent",
        "description"
      ],
      "properties": {
        "id": {
          "type": "string",
          "pattern": "^[a-z0-9]+(\\.[a-z0-9]+)*$"
        },
        "intent": {
          "type": "string",
          "minLength": 1
        },
        "description": {
          "type": "string",
          "minLength": 1
        }
      }
    },
    "constraints": {
      "type": "object",
      "additionalProperties": false,
      "required": [
        "motion"
      ],
      "properties": {
        "motion": {
          "type": "object",
          "additionalProperties": false,
          "required": [
            "allowedDurationsMs",
            "allowedTimingFunctions"
          ],
          "properties": {
            "allowedDurationsMs": {
              "type": "array",
              "minItems": 1,
              "items": {
                "type": "integer",
                "minimum": 1
              },
              "uniqueItems": true
            },
            "allowedTimingFunctions": {
              "type": "array",
              "minItems": 1,
              "items": {
                "type": "string",
                "minLength": 1
              },
              "uniqueItems": true
            }
          }
        }
      }
    },
    "pageFrame": {
      "type": "object",
      "additionalProperties": false,
      "required": [
        "containerSelector",
        "containerMaxWidthPx",
        "paddingXpx"
      ],
      "properties": {
        "containerSelector": {
          "type": "string",
          "minLength": 1
        },
        "containerMaxWidthPx": {
          "type": "number",
          "minimum": 0
        },
        "paddingXpx": {
          "type": "number",
          "minimum": 0
        },
        "alignment": {
          "type": "string",
          "enum": ["center", "left"],
          "default": "center"
        },
        "enforcement": {
          "type": "string",
          "enum": ["strict", "warn"],
          "default": "strict"
        }
      }
    },
    "color": {
      "type": "object",
      "additionalProperties": false,
      "properties": {
        "sourceOfTruth": {
          "$ref": "#/$defs/colorSourceOfTruth"
        },
        "rawValues": {
          "$ref": "#/$defs/colorRawValues"
        },
        "semantics": {
          "$ref": "#/$defs/colorSemantics"
        },
        "consistency": {
          "$ref": "#/$defs/colorConsistency"
        }
      }
    },
    "colorSourceOfTruth": {
      "type": "object",
      "additionalProperties": false,
      "required": ["type"],
      "properties": {
        "type": {
          "type": "string",
          "enum": ["tokens", "none"]
        },
        "tokenNamespaces": {
          "type": "array",
          "items": {
            "type": "string",
            "minLength": 1
          },
          "uniqueItems": true
        }
      },
      "if": {
        "properties": {
          "type": {
            "const": "tokens"
          }
        }
      },
      "then": {
        "required": ["tokenNamespaces"]
      }
    },
    "colorRawValues": {
      "type": "object",
      "additionalProperties": false,
      "required": ["policy"],
      "properties": {
        "policy": {
          "type": "string",
          "enum": ["off", "warn", "strict"]
        },
        "allowlist": {
          "type": "array",
          "items": {
            "type": "string",
            "minLength": 1
          },
          "uniqueItems": true
        },
        "denylist": {
          "type": "array",
          "items": {
            "type": "string",
            "minLength": 1
          },
          "uniqueItems": true
        }
      }
    },
    "colorSemantics": {
      "type": "object",
      "additionalProperties": false,
      "properties": {
        "roles": {
          "type": "object",
          "additionalProperties": false,
          "properties": {
            "accent": {
              "type": "object",
              "additionalProperties": false,
              "properties": {
                "enforcement": {
                  "type": "string",
                  "enum": ["off", "warn", "strict"]
                }
              }
            },
            "text": {
              "type": "object",
              "additionalProperties": false,
              "properties": {
                "enforcement": {
                  "type": "string",
                  "enum": ["off", "warn", "strict"]
                }
              }
            },
            "background": {
              "type": "object",
              "additionalProperties": false,
              "properties": {
                "enforcement": {
                  "type": "string",
                  "enum": ["off", "warn", "strict"]
                }
              }
            },
            "border": {
              "type": "object",
              "additionalProperties": false,
              "properties": {
                "enforcement": {
                  "type": "string",
                  "enum": ["off", "warn", "strict"]
                }
              }
            }
          }
        }
      }
    },
    "colorConsistency": {
      "type": "object",
      "additionalProperties": false,
      "properties": {
        "acrossSurfaces": {
          "type": "object",
          "additionalProperties": false,
          "properties": {
            "enforcement": {
              "type": "string",
              "enum": ["off", "warn", "strict"]
            },
            "signals": {
              "type": "array",
              "items": {
                "type": "string",
                "enum": ["token-name", "css-var-name", "class-fragment"]
              },
              "uniqueItems": true
            }
          }
        }
      }
    }
  }
}

