{
  "contractId": "test-pageframe",
  "version": "1.0.0",
  "surfaces": [
    {
      "id": "test-surface",
      "displayName": "Test Surface",
      "type": "web",
      "requiredSections": ["header"],
      "allowedFonts": ["Inter"],
      "allowedColors": ["#000000"],
      "layout": {
        "maxContentWidth": 1200,
        "pageFrame": {
          "containerSelector": ".container",
          "containerMaxWidthPx": 1200,
          "paddingXpx": 24,
          "alignment": "center",
          "enforcement": "strict"
        }
      }
    }
  ],
  "sections": [
    {
      "id": "header",
      "intent": "Page header",
      "description": "Main page header section"
    }
  ],
  "constraints": {
    "motion": {
      "allowedDurationsMs": [200, 300],
      "allowedTimingFunctions": ["ease", "ease-in-out"]
    }
  }
}
